,label,text,length,title,title_length,click_through,abandoned_cart,unsubscribed,open_rate,num_pics,num_videos,video_length,length_binned,title_length_binned,campaign_type,industry
2662,1,"Hello darling how are you today? I would love to have a chat, why dont you tell me what you look like and what you are in to sexy?",29,"Hello darling how are you today? I would love to have a chat, why dont you tell me what you look like and what you are in to sexy?",29,1,1,1,1,0,0,191,big,biggest,No_Opener,Hospitality
2663,1,8007 FREE for 1st week! No1 Nokia tone 4 ur mob every week just txt NOKIA to 8007 Get txting and tell ur mates www.getzed.co.uk POBox 36504 W4 5WQ norm 150p/tone 16+,32,8007 FREE for 1st week! No1 Nokia tone 4 ur mob every week just txt NOKIA to 8007 Get txting and tell ur mates www,25,0,1,0,0,0,1,16,big,biggest,Engagement_Campaign,Industrial
2664,0,He remains a bro amongst bros,6,He remains a bro amongst bros,6,0,0,1,1,1,2,42,small,med,No_Opener,Hospitality
2665,0,R u meeting da ge at nite tmr?,8,R u meeting da ge at nite tmr?,8,1,0,1,0,0,0,13,small,med,Engagement_Campaign,Automotive
2666,0,"* Was a nice day and, impressively, i was sensible, went home early and now feel fine. Or am i just boring?! When's yours, i can't remember.",27,"* Was a nice day and, impressively, i was sensible, went home early and now feel fine",17,1,1,1,1,5,1,22,big,biggest,Abandoned_Cart,Industrial
2667,0,Why de. You looking good only:-)..,6,Why de,2,1,1,0,0,3,0,57,small,small,Engagement_Campaign,Hospitality
2668,1,Wanna get laid 2nite? Want real Dogging locations sent direct to ur mobile? Join the UK's largest Dogging Network. Txt PARK to 69696 now! Nyt. ec2a. 3lp å£1.50/msg,28,Wanna get laid 2nite? Want real Dogging locations sent direct to ur mobile? Join the UK's largest Dogging Network,19,1,1,1,1,3,1,75,big,biggest,Survey,Industrial
2669,1,we tried to contact you re your response to our offer of a new nokia fone and camcorder hit reply or call 08000930705 for delivery,25,we tried to contact you re your response to our offer of a new nokia fone and camcorder hit reply or call 08000930705 for delivery,25,1,0,0,0,2,1,19,big,biggest,Revenue_Based,Industrial
2670,0,Yes. They replied my mail. I'm going to the management office later. Plus will in to bank later also.or on wednesday.,21,Yes,1,0,1,0,1,1,1,147,big,small,Abandoned_Cart,Automotive
2671,0,"That's cool, I'll come by like  &lt;#&gt; ish",8,"That's cool, I'll come by like  &lt;#&gt; ish",8,1,0,1,0,3,3,80,small,med,Survey,Industrial
2672,0,Super msg da:)nalla timing.,4,Super msg da:)nalla timing,4,0,0,1,1,3,3,42,small,small,Abandoned_Cart,Automotive
2673,0,"Good afternoon, my boytoy ... How are you feeling today ? Better I hope? Are you being my good boy? Are you my obedient, slave? Do you please your Queen?",30,"Good afternoon, my boytoy ",4,0,0,1,1,1,2,216,big,small,Revenue_Based,Real_Estate
2674,0,I am 6 ft. We will be a good combination!,10,I am 6 ft,4,1,1,1,1,1,0,99,small,small,Abandoned_Cart,Automotive
2675,0,I'm sick !! I'm needy !! I want you !! *pouts* *stomps feet* Where are you ?! *pouts* *stomps feet* I want my slave !! I want him now !!,30,I'm sick !! I'm needy !! I want you !! *pouts* *stomps feet* Where are you ?! *pouts* *stomps feet* I want my slave !! I want him now !!,30,1,0,0,1,5,0,14,big,biggest,Revenue_Based,Real_Estate
2676,0,* Am on a train back from northampton so i'm afraid not!,12,* Am on a train back from northampton so i'm afraid not!,12,1,0,1,0,0,3,195,med,big,Promotional,Industrial
2677,0,Where in abj are you serving. Are you staying with dad or alone.,13,Where in abj are you serving,6,0,1,1,1,4,0,180,med,med,No_Opener,Industrial
2678,0,Was playng 9 doors game and gt racing on phone lol,11,Was playng 9 doors game and gt racing on phone lol,11,1,0,0,0,3,1,141,med,big,Engagement_Campaign,Hospitality
2679,1,"New Tones This week include: 1)McFly-All Ab.., 2) Sara Jorge-Shock.. 3) Will Smith-Switch.. To order follow instructions on next message",20,New Tones This week include: 1)McFly-All Ab,7,0,1,0,1,5,0,95,med,med,Promotional,Industrial
2681,0,I'm on da bus going home...,6,I'm on da bus going home,6,0,0,1,0,1,1,199,small,med,Abandoned_Cart,Automotive
2682,0,I got a call from a landline number. . . I am asked to come to anna nagar . . . I will go in the afternoon,27,I got a call from a landline number,8,0,1,1,0,4,2,107,big,med,No_Opener,Automotive
2683,0,I'm okay. Chasing the dream. What's good. What are you doing next.,12,I'm okay,2,0,0,0,1,0,0,198,med,small,Promotional,Industrial
2684,0,Yupz... I've oredi booked slots 4 my weekends liao... ,9,Yupz,1,0,0,0,1,2,0,196,small,small,Abandoned_Cart,Industrial
2685,1,URGENT! We are trying to contact U. Todays draw shows that you have won a å£800 prize GUARANTEED. Call 09050003091 from land line. Claim C52. Valid 12hrs only,28,URGENT! We are trying to contact U,7,1,1,0,1,2,1,50,big,med,Revenue_Based,Automotive
2686,0,There r many model..sony ericson also der.. &lt;#&gt; ..it luks good bt i forgot modl no,16,There r many model,4,0,0,1,1,2,2,106,med,small,Revenue_Based,Medical
2688,0,Yes I know the cheesy songs from frosty the snowman :),11,Yes I know the cheesy songs from frosty the snowman :),11,0,0,0,0,2,3,113,med,big,No_Opener,Real_Estate
2689,0,"Ya ok, vikky vl c witin  &lt;#&gt; mins and il reply u..",12,"Ya ok, vikky vl c witin  &lt;#&gt; mins and il reply u",12,1,1,0,1,5,2,207,med,big,Survey,Automotive
2690,1,sports fans - get the latest sports news str* 2 ur mobile 1 wk FREE PLUS a FREE TONE Txt SPORT ON to 8007 www.getzed.co.uk 0870141701216+ norm 4txt/120p ,28,sports fans - get the latest sports news str* 2 ur mobile 1 wk FREE PLUS a FREE TONE Txt SPORT ON to 8007 www,25,0,0,0,0,5,3,70,big,biggest,No_Opener,Real_Estate
2691,0,Hey tmr meet at bugis 930 ?,7,Hey tmr meet at bugis 930 ?,7,0,1,1,0,1,0,101,small,med,Engagement_Campaign,Hospitality
2692,1,"Urgent Urgent! We have 800 FREE flights to Europe to give away, call B4 10th Sept & take a friend 4 FREE. Call now to claim on 09050000555. BA128NNFWFLY150ppm",29,"Urgent Urgent! We have 800 FREE flights to Europe to give away, call B4 10th Sept & take a friend 4 FREE",22,0,0,0,1,4,1,25,big,biggest,Revenue_Based,Real_Estate
2693,0,All these nice new shirts and the only thing I can wear them to is nudist themed ;_; you in mu?,21,All these nice new shirts and the only thing I can wear them to is nudist themed ;_; you in mu?,21,0,1,0,0,1,1,105,big,biggest,Abandoned_Cart,Medical
2694,0,Hey sexy buns! What of that day? No word from you this morning on YM ... :-( ... I think of you,22,Hey sexy buns! What of that day? No word from you this morning on YM ,15,0,1,1,0,3,0,146,big,bigger,Survey,Medical
2695,0,And whenever you and i see we can still hook up too.,12,And whenever you and i see we can still hook up too,12,0,1,0,0,2,2,53,med,big,Survey,Industrial
2696,0,Nope but i'm going home now then go pump petrol lor... Like going 2 rain soon...,16,Nope but i'm going home now then go pump petrol lor,11,0,0,0,0,4,0,62,med,big,Engagement_Campaign,Industrial
2697,0,Can you use foreign stamps for whatever you send them off for? ,12,Can you use foreign stamps for whatever you send them off for? ,12,1,0,0,0,5,1,192,med,big,No_Opener,Industrial
2698,1,FROM 88066 LOST å£12 HELP,5,FROM 88066 LOST å£12 HELP,5,0,1,1,1,3,3,65,small,med,Abandoned_Cart,Automotive
2699,0,Oh baby of the house. How come you dont have any new pictures on facebook,15,Oh baby of the house,5,0,1,0,0,0,0,174,med,med,Survey,Hospitality
2700,0,"Feb  &lt;#&gt;  is \I LOVE U\"" day. Send dis to all ur \""VALUED FRNDS\"" evn me. If 3 comes back u'll gt married d person u luv! If u ignore dis u will lose ur luv 4 Evr""",38,"Feb  &lt;#&gt;  is \I LOVE U\"" day",7,1,0,0,0,1,3,69,big,med,Survey,Medical
2701,0,"Hiya, sorry didn't hav signal. I haven't seen or heard from and neither has, which is unusual in itself! I'll put on the case and get him to sort it out! Hugs and snogs.",34,"Hiya, sorry didn't hav signal",5,0,1,0,0,2,0,79,big,med,Abandoned_Cart,Real_Estate
2702,0,"Omw back to tampa from west palm, you hear what happened?",11,"Omw back to tampa from west palm, you hear what happened?",11,1,1,1,1,3,0,112,med,big,Promotional,Real_Estate
2703,0,Yup no more already... Thanx 4 printing n handing it up.,11,Yup no more already,4,0,0,0,1,0,1,54,med,small,Abandoned_Cart,Industrial
2704,1,FreeMsg: Fancy a flirt? Reply DATE now & join the UKs fastest growing mobile dating service. Msgs rcvd just 25p to optout txt stop to 83021. Reply DATE now!,29,FreeMsg: Fancy a flirt? Reply DATE now & join the UKs fastest growing mobile dating service,16,0,1,0,0,3,0,74,big,bigger,No_Opener,Medical
2705,0,What i mean is do they come chase you out when its over or is it stated you can watch as many movies as you want.,26,What i mean is do they come chase you out when its over or is it stated you can watch as many movies as you want,26,0,0,1,1,1,3,38,big,biggest,Abandoned_Cart,Industrial
2706,0,S now only i took tablets . Reaction morning only.,10,S now only i took tablets ,6,1,1,1,0,3,3,44,small,med,Engagement_Campaign,Industrial
2707,1,Great NEW Offer - DOUBLE Mins & DOUBLE Txt on best Orange tariffs AND get latest camera phones 4 FREE! Call MobileUpd8 free on 08000839402 NOW! or 2stoptxt T&Cs,29,Great NEW Offer - DOUBLE Mins & DOUBLE Txt on best Orange tariffs AND get latest camera phones 4 FREE! Call MobileUpd8 free on 08000839402 NOW! or 2stoptxt T&Cs,29,0,1,0,1,4,0,219,big,biggest,Abandoned_Cart,Medical
2708,0,"Nah, I'm a perpetual DD",5,"Nah, I'm a perpetual DD",5,0,1,1,1,0,0,77,small,med,Abandoned_Cart,Medical
2709,0,Sorry de i went to shop.,6,Sorry de i went to shop,6,1,1,1,1,1,0,30,small,med,Survey,Medical
2710,1,Hope you enjoyed your new content. text stop to 61610 to unsubscribe. help:08712400602450p Provided by tones2you.co.uk,16,Hope you enjoyed your new content,6,1,0,0,1,4,2,164,med,med,Abandoned_Cart,Medical
2712,0,Hey you still want to go for yogasana? Coz if we end at cine then can go bathe and hav the steam bath,23,Hey you still want to go for yogasana? Coz if we end at cine then can go bathe and hav the steam bath,23,1,1,0,0,3,2,226,big,biggest,Revenue_Based,Automotive
2713,0,Nope i'm not drivin... I neva develop da photos lei...,10,Nope i'm not drivin,4,0,0,1,0,2,2,181,small,small,Abandoned_Cart,Medical
2714,0,I am thinking of going down to reg for pract lessons.. Flung my advance.. Haha wat time u going?,19,I am thinking of going down to reg for pract lessons,11,1,1,0,1,2,3,151,med,big,No_Opener,Industrial
2715,0,Cool. I am  &lt;#&gt;  inches long. hope you like them big!,11,Cool,1,0,0,1,1,1,1,38,med,small,Engagement_Campaign,Real_Estate
2716,0,"House-Maid is the murderer, coz the man was murdered on  &lt;#&gt; th January.. As public holiday all govt.instituitions are closed,including post office..understand?",22,"House-Maid is the murderer, coz the man was murdered on  &lt;#&gt; th January",13,0,1,0,0,3,1,215,big,bigger,No_Opener,Automotive
2717,0,Okie.. Thanx..,2,Okie,1,0,1,1,1,4,3,138,small,small,Revenue_Based,Real_Estate
2719,0,Go where n buy? Juz buy when we get there lar.,11,Go where n buy? Juz buy when we get there lar,11,1,1,1,0,0,3,190,med,big,No_Opener,Automotive
2721,0,I'm working technical support :)voice process.,6,I'm working technical support :)voice process,6,0,0,0,0,2,2,234,small,med,Promotional,Industrial
2722,0,It's justbeen overa week since we broke up and already our brains are going to mush!,16,It's justbeen overa week since we broke up and already our brains are going to mush!,16,1,0,0,1,4,1,117,med,bigger,Survey,Hospitality
2723,0,"Tunde, how are you doing. This is just wishing you a great day. Abiola.",14,"Tunde, how are you doing",5,0,0,0,1,3,0,119,med,med,No_Opener,Medical
2724,0,Nope... C Ì_ then...,4,Nope,1,0,1,0,1,2,3,125,small,small,Abandoned_Cart,Industrial
2725,0,No. But we'll do medical missions to nigeria,8,No,1,0,1,1,0,3,1,85,small,small,Promotional,Medical
2726,0,No i am not having not any movies in my laptop,11,No i am not having not any movies in my laptop,11,0,1,0,1,2,1,36,med,big,No_Opener,Industrial
2728,1,Urgent Please call 09066612661 from landline. å£5000 cash or a luxury 4* Canary Islands Holiday await collection. T&Cs SAE award. 20M12AQ. 150ppm. 16+ ÛÏ,24,Urgent Please call 09066612661 from landline,6,0,1,0,1,4,0,5,big,med,Survey,Real_Estate
2729,1,"Urgent! Please call 09066612661 from your landline, your complimentary 4* Lux Costa Del Sol holiday or å£1000 CASH await collection. ppm 150 SAE T&Cs James 28, EH74RR",27,"Urgent! Please call 09066612661 from your landline, your complimentary 4* Lux Costa Del Sol holiday or å£1000 CASH await collection",20,1,1,1,1,4,0,60,big,biggest,No_Opener,Automotive
2730,0,I havent lei.. Next mon can?,6,I havent lei,3,1,1,1,1,0,3,222,small,small,Revenue_Based,Medical
2731,0,Mm feeling sleepy. today itself i shall get that dear,10,Mm feeling sleepy,3,0,0,0,0,0,1,201,small,small,Revenue_Based,Hospitality
2732,0,How dare you stupid. I wont tell anything to you. Hear after i wont talk to you:-.,17,How dare you stupid,4,1,1,0,0,0,2,131,med,small,No_Opener,Real_Estate
2733,0,Do Ì_ noe if ben is going?,7,Do Ì_ noe if ben is going?,7,0,0,1,0,5,2,45,small,med,Engagement_Campaign,Real_Estate
2734,0,Can you do a mag meeting this avo at some point?,11,Can you do a mag meeting this avo at some point?,11,0,0,1,0,2,2,162,med,big,Promotional,Hospitality
2735,0,I meant middle left or right?,6,I meant middle left or right?,6,1,1,0,0,5,2,25,small,med,Revenue_Based,Industrial
2736,0,Really? I crashed out cuddled on my sofa.,8,Really? I crashed out cuddled on my sofa,8,0,0,0,1,4,1,50,small,med,Engagement_Campaign,Industrial
2737,0,Hi Chachi tried calling u now unable to reach u .. Pl give me a missed cal once u c tiz msg  Kanagu,23,Hi Chachi tried calling u now unable to reach u ,10,1,1,0,0,1,2,153,big,big,Promotional,Real_Estate
2738,0,"I sent you the prices and do you mean the  &lt;#&gt; g,",12,"I sent you the prices and do you mean the  &lt;#&gt; g,",12,1,0,1,0,0,2,38,med,big,Survey,Automotive
2740,0,Nothing. Can...,2,Nothing,1,1,0,1,1,2,2,66,small,small,Promotional,Hospitality
2742,0,No * am working on the ringing u thing but have whole houseful of screaming brats so * am pulling my hair out! Loving u,25,No * am working on the ringing u thing but have whole houseful of screaming brats so * am pulling my hair out! Loving u,25,1,1,0,1,3,1,91,big,biggest,Promotional,Hospitality
2743,0,But my family not responding for anything. Now am in room not went to home for diwali but no one called me and why not coming. It makes me feel like died.,32,But my family not responding for anything,7,0,0,1,1,2,2,76,big,med,Abandoned_Cart,Medical
2744,0,"Tick, tick, tick ... Babe",5,"Tick, tick, tick ",3,0,1,0,1,2,3,159,small,small,Survey,Real_Estate
2745,0,R Ì_ going 4 today's meeting?,6,R Ì_ going 4 today's meeting?,6,1,1,0,0,1,2,100,small,med,Survey,Real_Estate
2746,0,K da:)how many page you want?,6,K da:)how many page you want?,6,0,1,0,1,4,0,67,small,med,Engagement_Campaign,Industrial
2747,0,Ya had just now.onion roast.,5,Ya had just now,4,1,0,0,0,3,3,101,small,small,Promotional,Industrial
2748,0,Send his number and give reply tomorrow morning for why you said that to him like that ok,18,Send his number and give reply tomorrow morning for why you said that to him like that ok,18,0,0,0,1,1,0,4,med,biggest,No_Opener,Industrial
2749,0,You said not now. No problem. When you can. Let me know.,12,You said not now,4,1,0,0,1,3,2,38,med,small,Promotional,Real_Estate
2750,0,Ok but tell me half an hr b4 u come i need 2 prepare.,14,Ok but tell me half an hr b4 u come i need 2 prepare,14,1,0,1,1,5,0,184,med,bigger,Promotional,Automotive
2751,0,Play w computer? Aiyah i tok 2 u lor?,9,Play w computer? Aiyah i tok 2 u lor?,9,1,0,1,0,3,3,28,small,big,Engagement_Campaign,Automotive
2752,0,Sat right? Okay thanks... ,4,Sat right? Okay thanks,4,1,0,0,0,5,0,32,small,small,Engagement_Campaign,Hospitality
2753,0,"Derp. Which is worse, a dude who always wants to party or a dude who files a complaint about the three drug abusers he lives with",26,Derp,1,1,0,1,0,3,2,12,big,small,Promotional,Real_Estate
2754,0,Ok Chinese food on its way. When I get fat you're paying for my lipo.,15,Ok Chinese food on its way,6,1,1,1,0,2,0,56,med,med,Engagement_Campaign,Automotive
2755,0,We r outside already.,4,We r outside already,4,1,1,1,1,1,3,126,small,small,Revenue_Based,Medical
2756,0,Have a good trip. Watch out for . Remember when you get back we must decide about easter.,18,Have a good trip,4,1,0,0,1,2,1,104,med,small,Survey,Real_Estate
2757,0,Yo we are watching a movie on netflix,8,Yo we are watching a movie on netflix,8,0,1,1,1,1,0,144,small,med,Revenue_Based,Real_Estate
2758,0,What time. IÛ÷m out until prob 3 or so,9,What time,2,0,1,0,1,5,2,91,small,small,No_Opener,Industrial
2759,0,"Can meh? Thgt some will clash... Really ah, i dun mind... I dun seen to have lost any weight... Gee...",20,Can meh? Thgt some will clash,6,0,1,0,1,3,2,190,med,med,Promotional,Hospitality
2762,0,ARR birthday today:) i wish him to get more oscar.,10,ARR birthday today:) i wish him to get more oscar,10,1,0,0,1,2,3,156,small,big,No_Opener,Medical
2764,0,"Open rebtel with firefox. When it loads just put plus sign in the user name place, and it will show you two numbers. The lower number is my number. Once you pick that number the pin will display okay!",39,Open rebtel with firefox,4,1,0,1,1,2,3,170,big,small,Survey,Automotive
2765,0, and  picking them up from various points,7, and  picking them up from various points,7,0,1,1,0,0,1,145,small,med,Abandoned_Cart,Medical
2766,1,Married local women looking for discreet action now! 5 real matches instantly to your phone. Text MATCH to 69969 Msg cost 150p 2 stop txt stop BCMSFWC1N3XX,27,Married local women looking for discreet action now! 5 real matches instantly to your phone,15,1,0,1,0,2,0,36,big,bigger,Survey,Industrial
2767,0,Wow v v impressed. Have funs shopping!,7,Wow v v impressed,4,1,1,0,1,1,1,219,small,small,Abandoned_Cart,Industrial
2768,0,I am on the way to ur home,8,I am on the way to ur home,8,0,1,0,0,0,2,133,small,med,No_Opener,Real_Estate
2769,1,Burger King - Wanna play footy at a top stadium? Get 2 Burger King before 1st Sept and go Large or Super with Coca-Cola and walk out a winner,29,Burger King - Wanna play footy at a top stadium? Get 2 Burger King before 1st Sept and go Large or Super with Coca-Cola and walk out a winner,29,1,1,0,1,1,1,87,big,biggest,Survey,Automotive
2770,0,No problem. Talk to you later,6,No problem,2,0,1,1,1,3,0,9,small,small,Abandoned_Cart,Hospitality
2771,0,Then ur sis how?,4,Then ur sis how?,4,0,0,0,0,5,0,87,small,small,Engagement_Campaign,Industrial
2772,0,Still in customer place,4,Still in customer place,4,1,0,1,0,4,1,32,small,small,Promotional,Automotive
2773,1,How come it takes so little time for a child who is afraid of the dark to become a teenager who wants to stay out all night?,27,How come it takes so little time for a child who is afraid of the dark to become a teenager who wants to stay out all night?,27,1,0,1,0,3,1,39,big,biggest,No_Opener,Automotive
2774,0,"Dude u knw also telugu..thts gud..k, gud nyt..",8,Dude u knw also telugu,5,0,0,1,0,1,1,105,small,med,Survey,Automotive
2775,0,We confirm eating at esplanade?,5,We confirm eating at esplanade?,5,0,1,1,1,0,1,88,small,med,Engagement_Campaign,Real_Estate
2776,0,Send me your id and password,6,Send me your id and password,6,1,1,0,0,2,0,156,small,med,Promotional,Hospitality
2777,0,Kind of. Took it to garage. Centre part of exhaust needs replacing. Part ordered n taking it to be fixed tomo morning.,22,Kind of,2,1,0,0,0,5,0,63,big,small,Promotional,Medical
2778,1,"For ur chance to win a å£250 cash every wk TXT: ACTION to 80608. T's&C's www.movietrivia.tv custcare 08712405022, 1x150p/wk.",19,For ur chance to win a å£250 cash every wk TXT: ACTION to 80608,14,1,1,0,0,2,3,80,med,bigger,Engagement_Campaign,Hospitality
2779,0,Well I might not come then...,6,Well I might not come then,6,0,1,0,1,3,1,48,small,med,No_Opener,Real_Estate
2780,0,Long after I quit. I get on only like 5 minutes a day as it is.,16,Long after I quit,4,0,0,0,0,0,1,175,med,small,Engagement_Campaign,Real_Estate
2781,0,Then its most likely called Mittelschmertz. Google it. If you dont have paracetamol dont worry it will go.,18,Then its most likely called Mittelschmertz,6,1,0,0,1,3,1,120,med,med,Revenue_Based,Medical
2782,0,Well at this right I'm gonna have to get up and check today's steam sales/pee so text me when you want me to come get you,26,Well at this right I'm gonna have to get up and check today's steam sales/pee so text me when you want me to come get you,26,0,1,1,1,4,1,127,big,biggest,Promotional,Industrial
2783,0,"Just arrived, see you in a couple days &lt;3",9,"Just arrived, see you in a couple days &lt;3",9,1,0,1,1,3,2,46,small,big,Promotional,Hospitality
2784,0,"K, wat s tht incident?",5,"K, wat s tht incident?",5,1,1,0,0,5,0,65,small,med,No_Opener,Automotive
2785,0,Yeah get the unlimited,4,Yeah get the unlimited,4,1,0,0,0,3,2,1,small,small,Engagement_Campaign,Automotive
2786,0,cThen i thk shd b enuff.. Still got conclusion n contents pg n references.. I'll b doing da contents pg n cover pg..,23,cThen i thk shd b enuff,6,0,0,1,0,1,3,177,big,med,Revenue_Based,Real_Estate
2787,0,"Forgot it takes me 3 years to shower, sorry. Where you at/your phone dead yet?",15,"Forgot it takes me 3 years to shower, sorry",9,0,1,0,1,5,2,90,med,big,Abandoned_Cart,Medical
2788,0,ÌÏ got wat to buy tell us then Ì_ no need to come in again.,15,ÌÏ got wat to buy tell us then Ì_ no need to come in again,15,0,0,0,0,3,0,7,med,bigger,Promotional,Automotive
2789,0,When you are big..| God will bring success.,8,When you are big,4,1,0,0,0,1,3,89,small,small,Abandoned_Cart,Real_Estate
2790,1,UÛªve Bin Awarded å£50 to Play 4 Instant Cash. Call 08715203028 To Claim. EVERY 9th Player Wins Min å£50-å£500. OptOut 08718727870,21,UÛªve Bin Awarded å£50 to Play 4 Instant Cash,9,0,1,0,1,5,3,13,big,big,Survey,Automotive
2791,0,"Û_ we r stayin here an extra week, back next wed. How did we do in the rugby this weekend? Hi to and and , c u soon \""ham""",30,"Û_ we r stayin here an extra week, back next wed",11,1,0,0,0,5,0,95,big,big,Survey,Industrial
2792,0,Not from this campus. Are you in the library?,9,Not from this campus,4,1,1,1,0,3,2,57,small,small,No_Opener,Medical
2793,0,"The affidavit says  &lt;#&gt;  E Twiggs St, division g, courtroom  &lt;#&gt; , &lt;TIME&gt;  AM. I'll double check and text you again tomorrow",22,"The affidavit says  &lt;#&gt;  E Twiggs St, division g, courtroom  &lt;#&gt; , &lt;TIME&gt;  AM",14,1,0,0,1,2,3,155,big,bigger,Promotional,Hospitality
2794,0,How will I creep on you now? ;_;,8,How will I creep on you now? ;_;,8,0,1,0,0,0,2,168,small,med,Engagement_Campaign,Medical
2796,0,If I get there before you after your ten billion calls and texts so help me god,17,If I get there before you after your ten billion calls and texts so help me god,17,0,1,0,1,2,2,31,med,biggest,Engagement_Campaign,Hospitality
2798,0,I've told him that i've returned it. That should i re order it.,13,I've told him that i've returned it,7,0,0,0,1,1,0,98,med,med,Promotional,Medical
2799,0,"House-Maid is the murderer, coz the man was murdered on  &lt;#&gt; th January.. As public holiday all govt.instituitions are closed,including post office..",22,"House-Maid is the murderer, coz the man was murdered on  &lt;#&gt; th January",13,1,0,0,0,2,3,138,big,bigger,Engagement_Campaign,Hospitality
2800,0,Depends on where u going lor.,6,Depends on where u going lor,6,0,1,1,0,0,0,116,small,med,No_Opener,Hospitality
2801,0,And smile for me right now as you go and the world will wonder what you are smiling about and think your crazy and keep away from you ... *grins*,30,And smile for me right now as you go and the world will wonder what you are smiling about and think your crazy and keep away from you ,28,1,1,1,1,3,3,27,big,biggest,Abandoned_Cart,Automotive
2802,1,FreeMsg>FAV XMAS TONES!Reply REAL,4,FreeMsg>FAV XMAS TONES!Reply REAL,4,0,0,1,0,1,0,2,small,small,Survey,Medical
2803,0,Lil fever:) now fine:),4,Lil fever:) now fine:),4,0,0,1,0,1,2,125,small,small,No_Opener,Hospitality
2804,0,I think it's all still in my car,8,I think it's all still in my car,8,0,0,1,0,2,0,189,small,med,Survey,Hospitality
2805,0,Can a not?,3,Can a not?,3,0,0,0,1,0,1,34,small,small,Engagement_Campaign,Automotive
2806,1,December only! Had your mobile 11mths+? You are entitled to update to the latest colour camera mobile for Free! Call The Mobile Update Co FREE on 08002986906 ,27,December only! Had your mobile 11mths+? You are entitled to update to the latest colour camera mobile for Free! Call The Mobile Update Co FREE on 08002986906 ,27,1,1,0,1,5,0,160,big,biggest,Abandoned_Cart,Industrial
2807,0,Yes princess! I want to catch you with my big strong hands...,12,Yes princess! I want to catch you with my big strong hands,12,1,1,0,0,3,1,99,med,big,Promotional,Real_Estate
2808,0,Oh yeah I forgot. U can only take 2 out shopping at once.,13,Oh yeah I forgot,4,1,1,1,1,1,0,214,med,small,Revenue_Based,Industrial
2809,0,Mm so you asked me not to call radio,9,Mm so you asked me not to call radio,9,0,1,0,1,4,3,164,small,big,Abandoned_Cart,Automotive
2810,0,Thinkin about someone is all good. No drugs for that,10,Thinkin about someone is all good,6,0,1,1,1,3,3,216,small,med,Survey,Industrial
2812,0,"Enjoy the showers of possessiveness poured on u by ur loved ones, bcoz in this world of lies, it is a golden gift to be loved truly..",27,"Enjoy the showers of possessiveness poured on u by ur loved ones, bcoz in this world of lies, it is a golden gift to be loved truly",27,0,0,1,0,5,3,151,big,biggest,Engagement_Campaign,Real_Estate
2813,0,"Alright if you're sure, let me know when you're leaving",10,"Alright if you're sure, let me know when you're leaving",10,0,1,1,1,4,1,143,small,big,Revenue_Based,Industrial
