,label,text,length,title,title_length,click_through,abandoned_cart,unsubscribed,open_rate,num_pics,num_videos,video_length,length_binned,title_length_binned,campaign_type,industry
0,0,"Go until jurong point, crazy.. Available only in bugis n great world la e buffet... Cine there got amore wat...",20,"Go until jurong point, crazy",5,0,1,0,1,2,0,176,med,med,Promotional,Automotive
1,0,Ok lar... Joking wif u oni...,6,Ok lar,2,1,0,0,0,2,1,54,small,small,Abandoned_Cart,Hospitality
2,1,Free entry in 2 a wkly comp to win FA Cup final tkts 21st May 2005. Text FA to 87121 to receive entry question(std txt rate)T&C's apply 08452810075over18's,28,Free entry in 2 a wkly comp to win FA Cup final tkts 21st May 2005,16,0,0,1,1,2,3,21,big,bigger,Survey,Industrial
3,0,U dun say so early hor... U c already then say...,11,U dun say so early hor,6,1,0,0,1,0,1,8,med,med,Revenue_Based,Automotive
4,0,"Nah I don't think he goes to usf, he lives around here though",13,"Nah I don't think he goes to usf, he lives around here though",13,1,0,0,0,5,3,44,med,bigger,Promotional,Medical
5,1,"FreeMsg Hey there darling it's been 3 week's now and no word back! I'd like some fun you up for it still? Tb ok! XxX std chgs to send, å£1.50 to rcv",32,"FreeMsg Hey there darling it's been 3 week's now and no word back! I'd like some fun you up for it still? Tb ok! XxX std chgs to send, å£1",30,1,1,1,1,4,3,8,big,biggest,Abandoned_Cart,Real_Estate
6,0,Even my brother is not like to speak with me. They treat me like aids patent.,16,Even my brother is not like to speak with me,10,0,0,0,0,4,3,101,med,big,Revenue_Based,Automotive
7,0,As per your request 'Melle Melle (Oru Minnaminunginte Nurungu Vettam)' has been set as your callertune for all Callers. Press *9 to copy your friends Callertune,26,As per your request 'Melle Melle (Oru Minnaminunginte Nurungu Vettam)' has been set as your callertune for all Callers,19,0,1,1,1,3,3,34,big,biggest,Survey,Real_Estate
8,1,WINNER!! As a valued network customer you have been selected to receivea å£900 prize reward! To claim call 09061701461. Claim code KL341. Valid 12 hours only.,26,WINNER!! As a valued network customer you have been selected to receivea å£900 prize reward! To claim call 09061701461,19,0,0,0,1,3,1,133,big,biggest,No_Opener,Real_Estate
9,1,Had your mobile 11 months or more? U R entitled to Update to the latest colour mobiles with camera for Free! Call The Mobile Update Co FREE on 08002986030,29,Had your mobile 11 months or more? U R entitled to Update to the latest colour mobiles with camera for Free! Call The Mobile Update Co FREE on 08002986030,29,0,0,0,0,3,3,157,big,biggest,Engagement_Campaign,Automotive
10,0,"I'm gonna be home soon and i don't want to talk about this stuff anymore tonight, k? I've cried enough today.",21,"I'm gonna be home soon and i don't want to talk about this stuff anymore tonight, k? I've cried enough today",21,0,0,1,1,1,1,93,big,biggest,Engagement_Campaign,Medical
11,1,"SIX chances to win CASH! From 100 to 20,000 pounds txt> CSH11 and send to 87575. Cost 150p/day, 6days, 16+ TsandCs apply Reply HL 4 info",26,"SIX chances to win CASH! From 100 to 20,000 pounds txt> CSH11 and send to 87575",16,0,0,1,1,2,2,65,big,bigger,Engagement_Campaign,Real_Estate
12,1,"URGENT! You have won a 1 week FREE membership in our å£100,000 Prize Jackpot! Txt the word: CLAIM to No: 81010 T&C www.dbuk.net LCCLTD POBOX 4403LDNW1A7RW18",26,"URGENT! You have won a 1 week FREE membership in our å£100,000 Prize Jackpot! Txt the word: CLAIM to No: 81010 T&C www",23,1,1,1,0,1,1,230,big,biggest,Survey,Automotive
13,0,I've been searching for the right words to thank you for this breather. I promise i wont take your help for granted and will fulfil my promise. You have been wonderful and a blessing at all times.,37,I've been searching for the right words to thank you for this breather,13,0,0,1,0,5,2,175,big,bigger,Promotional,Hospitality
14,0,I HAVE A DATE ON SUNDAY WITH WILL!!,8,I HAVE A DATE ON SUNDAY WITH WILL!!,8,1,1,1,0,0,3,56,small,med,No_Opener,Automotive
15,1,"XXXMobileMovieClub: To use your credit, click the WAP link in the next txt message or click here>> http://wap. xxxmobilemovieclub.com?n=QJKGIGHJJGCBL",19,"XXXMobileMovieClub: To use your credit, click the WAP link in the next txt message or click here>> http://wap",18,1,1,0,1,3,1,29,med,biggest,Promotional,Industrial
16,0,Oh k...i'm watching here:),4,Oh k,2,1,0,0,0,4,3,79,small,small,Promotional,Industrial
17,0,Eh u remember how 2 spell his name... Yes i did. He v naughty make until i v wet.,19,Eh u remember how 2 spell his name,8,1,1,1,1,4,0,17,med,med,Promotional,Industrial
18,0,Fine if thatåÕs the way u feel. ThatåÕs the way its gota b,13,Fine if thatåÕs the way u feel,7,0,1,0,1,2,1,202,med,med,No_Opener,Hospitality
19,1,"England v Macedonia - dont miss the goals/team news. Txt ur national team to 87077 eg ENGLAND to 87077 Try:WALES, SCOTLAND 4txt/Ì¼1.20 POBOXox36504W45WQ 16+",24,England v Macedonia - dont miss the goals/team news,9,0,0,0,0,3,2,8,big,big,Engagement_Campaign,Medical
20,0,Is that seriously how you spell his name?,8,Is that seriously how you spell his name?,8,0,0,1,1,1,0,213,small,med,Promotional,Automotive
21,0,IÛ÷m going to try for 2 months ha ha only joking,11,IÛ÷m going to try for 2 months ha ha only joking,11,0,1,0,1,3,2,135,med,big,Survey,Industrial
22,0,So Ì_ pay first lar... Then when is da stock comin...,11,So Ì_ pay first lar,5,1,1,0,1,1,0,95,med,med,Promotional,Medical
23,0,Aft i finish my lunch then i go str down lor. Ard 3 smth lor. U finish ur lunch already?,20,Aft i finish my lunch then i go str down lor,11,1,1,1,0,4,0,161,med,big,No_Opener,Industrial
24,0,Ffffffffff. Alright no way I can meet up with you sooner?,11,Ffffffffff,1,1,0,0,0,0,1,168,med,small,Engagement_Campaign,Automotive
25,0,Just forced myself to eat a slice. I'm really not hungry tho. This sucks. Mark is getting worried. He knows I'm sick when I turn down pizza. Lol,28,Just forced myself to eat a slice,7,1,0,0,0,4,2,223,big,med,Engagement_Campaign,Medical
26,0,Lol your always so convincing.,5,Lol your always so convincing,5,1,1,0,1,2,2,179,small,med,No_Opener,Real_Estate
27,0,Did you catch the bus ? Are you frying an egg ? Did you make a tea? Are you eating your mom's left over dinner ? Do you feel my Love ?,32,Did you catch the bus ? Are you frying an egg ? Did you make a tea? Are you eating your mom's left over dinner ? Do you feel my Love ?,32,1,0,0,1,4,0,70,big,biggest,Promotional,Hospitality
28,0,"I'm back &amp; we're packing the car now, I'll let you know if there's room",15,"I'm back &amp; we're packing the car now, I'll let you know if there's room",15,1,0,1,0,0,2,45,med,bigger,No_Opener,Industrial
29,0,Ahhh. Work. I vaguely remember that! What does it feel like? Lol,12,Ahhh,1,0,1,0,1,4,1,18,med,small,Abandoned_Cart,Industrial
30,0,"Wait that's still not all that clear, were you not sure about me being sarcastic or that that's why x doesn't want to live with us",26,"Wait that's still not all that clear, were you not sure about me being sarcastic or that that's why x doesn't want to live with us",26,1,0,0,1,4,0,25,big,biggest,Abandoned_Cart,Medical
31,0,Yeah he got in at 2 and was v apologetic. n had fallen out and she was actin like spoilt child and he got caught up in that. Till 2! But we won't go there! Not doing too badly cheers. You? ,41,Yeah he got in at 2 and was v apologetic,10,0,1,0,1,0,0,97,biggest,big,Survey,Hospitality
32,0,K tell me anything about you.,6,K tell me anything about you,6,0,1,1,0,2,3,8,small,med,Abandoned_Cart,Hospitality
33,0,For fear of fainting with the of all that housework you just did? Quick have a cuppa,17,For fear of fainting with the of all that housework you just did? Quick have a cuppa,17,1,0,1,1,4,1,84,med,biggest,Engagement_Campaign,Hospitality
34,1,Thanks for your subscription to Ringtone UK your mobile will be charged å£5/month Please confirm by replying YES or NO. If you reply NO you will not be charged,29,Thanks for your subscription to Ringtone UK your mobile will be charged å£5/month Please confirm by replying YES or NO,20,1,0,0,1,2,2,102,big,biggest,Survey,Medical
35,0,Yup... Ok i go home look at the timings then i msg Ì_ again... Xuhui going to learn on 2nd may too but her lesson is at 8am,28,Yup,1,0,0,0,0,2,3,1,big,small,Abandoned_Cart,Medical
36,0,"Oops, I'll let you know when my roommate's done",9,"Oops, I'll let you know when my roommate's done",9,0,1,0,0,5,1,44,small,big,Revenue_Based,Medical
37,0,I see the letter B on my car,8,I see the letter B on my car,8,1,0,0,1,2,2,211,small,med,Revenue_Based,Real_Estate
38,0,Anything lor... U decide...,4,Anything lor,2,1,0,1,1,3,1,38,small,small,Engagement_Campaign,Industrial
39,0,Hello! How's you and how did saturday go? I was just texting to see if you'd decided to do anything tomo. Not that i'm trying to invite myself or anything!,30,Hello! How's you and how did saturday go? I was just texting to see if you'd decided to do anything tomo,21,0,0,1,1,5,1,60,big,biggest,Engagement_Campaign,Automotive
40,0,Pls go ahead with watts. I just wanted to be sure. Do have a great weekend. Abiola,17,Pls go ahead with watts,5,1,1,0,0,4,3,40,med,med,No_Opener,Real_Estate
41,0,"Did I forget to tell you ? I want you , I need you, I crave you ... But most of all ... I love you my sweet Arabian steed ... Mmmmmm ... Yummy",34,"Did I forget to tell you ? I want you , I need you, I crave you ",17,1,1,1,1,3,2,126,big,biggest,Engagement_Campaign,Industrial
42,1,07732584351 - Rodger Burns - MSG = We tried to call you re your reply to our sms for a free nokia mobile + free camcorder. Please call now 08000930705 for delivery tomorrow,33,07732584351 - Rodger Burns - MSG = We tried to call you re your reply to our sms for a free nokia mobile + free camcorder,26,0,1,1,1,1,3,68,big,biggest,Abandoned_Cart,Industrial
43,0,WHO ARE YOU SEEING?,4,WHO ARE YOU SEEING?,4,1,1,1,0,4,1,193,small,small,Survey,Medical
44,0,Great! I hope you like your man well endowed. I am  &lt;#&gt;  inches...,13,Great! I hope you like your man well endowed,9,1,0,0,1,1,0,137,med,big,Promotional,Automotive
45,0,No calls..messages..missed calls,3,No calls,2,1,1,0,1,0,0,111,small,small,Abandoned_Cart,Medical
46,0,Didn't you get hep b immunisation in nigeria.,8,Didn't you get hep b immunisation in nigeria,8,1,0,0,1,1,3,128,small,med,No_Opener,Hospitality
47,0,"Fair enough, anything going on?",5,"Fair enough, anything going on?",5,0,1,1,0,2,2,18,small,med,Revenue_Based,Hospitality
48,0,"Yeah hopefully, if tyler can't do it I could maybe ask around a bit",14,"Yeah hopefully, if tyler can't do it I could maybe ask around a bit",14,1,1,0,1,5,3,160,med,bigger,Survey,Real_Estate
49,0,U don't know how stubborn I am. I didn't even want to go to the hospital. I kept telling Mark I'm not a weak sucker. Hospitals are for weak suckers.,30,U don't know how stubborn I am,7,0,1,0,0,4,0,86,big,med,Revenue_Based,Industrial
50,0,What you thinked about me. First time you saw me in class.,12,What you thinked about me,5,1,0,0,0,4,2,53,med,med,Promotional,Real_Estate
51,0,"A gram usually runs like  &lt;#&gt; , a half eighth is smarter though and gets you almost a whole second gram for  &lt;#&gt;",23,"A gram usually runs like  &lt;#&gt; , a half eighth is smarter though and gets you almost a whole second gram for  &lt;#&gt;",23,1,1,1,0,3,1,155,big,biggest,Promotional,Industrial
52,0,K fyi x has a ride early tomorrow morning but he's crashing at our place tonight,16,K fyi x has a ride early tomorrow morning but he's crashing at our place tonight,16,0,1,0,1,3,1,32,med,bigger,No_Opener,Automotive
53,0,"Wow. I never realized that you were so embarassed by your accomodations. I thought you liked it, since i was doing the best i could and you always seemed so happy about \the cave\"". I'm sorry I didn't and don't have more to give. I'm sorry i offered. I'm sorry your room was so embarassing.""",55,Wow,1,0,1,1,0,0,1,115,biggest,small,Revenue_Based,Industrial
54,1,SMS. ac Sptv: The New Jersey Devils and the Detroit Red Wings play Ice Hockey. Correct or Incorrect? End? Reply END SPTV,22,SMS,1,1,0,1,0,1,1,88,big,small,Revenue_Based,Real_Estate
55,0,Do you know what Mallika Sherawat did yesterday? Find out now @  &lt;URL&gt;,13,Do you know what Mallika Sherawat did yesterday? Find out now @  &lt;URL&gt;,13,0,1,0,0,0,1,30,med,bigger,Engagement_Campaign,Hospitality
56,1,"Congrats! 1 year special cinema pass for 2 is yours. call 09061209465 now! C Suprman V, Matrix3, StarWars3, etc all 4 FREE! bx420-ip4-5we. 150pm. Dont miss out! ",27,Congrats! 1 year special cinema pass for 2 is yours,10,1,1,0,1,2,2,166,big,big,Abandoned_Cart,Automotive
57,0,"Sorry, I'll call later in meeting.",6,"Sorry, I'll call later in meeting",6,1,0,0,1,4,1,72,small,med,Survey,Industrial
58,0,Tell where you reached,4,Tell where you reached,4,0,1,1,1,2,3,170,small,small,Abandoned_Cart,Real_Estate
59,0,Yes..gauti and sehwag out of odi series.,7,Yes,1,0,1,0,0,4,0,202,small,small,Abandoned_Cart,Automotive
60,0,Your gonna have to pick up a $1 burger for yourself on your way home. I can't even move. Pain is killing me.,23,Your gonna have to pick up a $1 burger for yourself on your way home,15,0,0,1,1,0,1,166,big,bigger,Survey,Medical
61,0,Ha ha ha good joke. Girls are situation seekers.,9,Ha ha ha good joke,5,0,0,0,1,3,0,129,small,med,Survey,Medical
62,0,Its a part of checking IQ,6,Its a part of checking IQ,6,0,1,0,1,2,0,1,small,med,Promotional,Medical
63,0,"Sorry my roommates took forever, it ok if I come by now?",12,"Sorry my roommates took forever, it ok if I come by now?",12,0,1,1,0,4,3,224,med,big,Abandoned_Cart,Hospitality
64,0,Ok lar i double check wif da hair dresser already he said wun cut v short. He said will cut until i look nice.,24,Ok lar i double check wif da hair dresser already he said wun cut v short,16,1,0,1,1,1,1,107,big,bigger,Abandoned_Cart,Real_Estate
65,1,"As a valued customer, I am pleased to advise you that following recent review of your Mob No. you are awarded with a å£1500 Bonus Prize, call 09066364589",28,"As a valued customer, I am pleased to advise you that following recent review of your Mob No",18,1,1,0,0,1,3,24,big,biggest,Survey,Automotive
66,0,"Today is \song dedicated day..\"" Which song will u dedicate for me? Send this to all ur valuable frnds but first rply me...""",23,Today is \song dedicated day,5,0,1,1,0,2,3,161,big,med,Abandoned_Cart,Hospitality
67,1,"Urgent UR awarded a complimentary trip to EuroDisinc Trav, Aco&Entry41 Or å£1000. To claim txt DIS to 87121 18+6*å£1.50(moreFrmMob. ShrAcomOrSglSuplt)10, LS1 3AJ",22,"Urgent UR awarded a complimentary trip to EuroDisinc Trav, Aco&Entry41 Or å£1000",12,1,1,0,0,4,2,2,big,big,Abandoned_Cart,Real_Estate
68,1,"Did you hear about the new \Divorce Barbie\""? It comes with all of Ken's stuff!""",15,"Did you hear about the new \Divorce Barbie\""? It comes with all of Ken's stuff!""",15,0,1,0,1,4,3,185,med,bigger,Revenue_Based,Real_Estate
69,0,I plane to give on this month end.,8,I plane to give on this month end,8,0,0,1,0,3,2,14,small,med,Revenue_Based,Hospitality
70,0,Wah lucky man... Then can save money... Hee...,8,Wah lucky man,3,0,1,1,1,4,0,29,small,small,Abandoned_Cart,Automotive
71,0,Finished class where are you.,5,Finished class where are you,5,1,0,1,1,0,2,56,small,med,Abandoned_Cart,Automotive
72,0,HI BABE IM AT HOME NOW WANNA DO SOMETHING? XX,10,HI BABE IM AT HOME NOW WANNA DO SOMETHING? XX,10,1,0,1,0,1,2,72,small,big,Survey,Medical
73,0,K..k:)where are you?how did you performed?,6,K,1,1,1,0,0,1,3,115,small,small,No_Opener,Industrial
74,0,U can call me now...,5,U can call me now,5,1,1,1,1,2,1,70,small,med,Survey,Automotive
75,0,I am waiting machan. Call me once you free.,9,I am waiting machan,4,0,1,1,0,3,3,210,small,small,Promotional,Industrial
76,0,Thats cool. i am a gentleman and will treat you with dignity and respect.,14,Thats cool,2,1,1,0,1,4,0,6,med,small,No_Opener,Industrial
77,0,I like you peoples very much:) but am very shy pa.,11,I like you peoples very much:) but am very shy pa,11,1,0,1,0,0,1,146,med,big,Promotional,Automotive
78,0,Does not operate after  &lt;#&gt;  or what,7,Does not operate after  &lt;#&gt;  or what,7,1,0,0,1,4,3,46,small,med,Engagement_Campaign,Automotive
79,0,Its not the same here. Still looking for a job. How much do Ta's earn there.,16,Its not the same here,5,0,0,0,0,5,1,187,med,med,Survey,Automotive
80,0,"Sorry, I'll call later",4,"Sorry, I'll call later",4,0,1,1,1,5,0,0,small,small,Abandoned_Cart,Real_Estate
81,0,K. Did you call me just now ah? ,8,K,1,0,1,1,0,5,1,118,small,small,Survey,Real_Estate
82,0,Ok i am on the way to home hi hi,10,Ok i am on the way to home hi hi,10,1,0,0,1,0,2,195,small,big,Engagement_Campaign,Automotive
83,0,You will be in the place of that man,9,You will be in the place of that man,9,1,1,1,0,1,2,136,small,big,Abandoned_Cart,Medical
84,0,Yup next stop.,3,Yup next stop,3,0,1,0,1,4,0,53,small,small,Revenue_Based,Industrial
85,0,"I call you later, don't have network. If urgnt, sms me.",11,"I call you later, don't have network",7,1,0,1,1,5,3,214,med,med,Engagement_Campaign,Real_Estate
86,0,For real when u getting on yo? I only need 2 more tickets and one more jacket and I'm done. I already used all my multis.,26,For real when u getting on yo? I only need 2 more tickets and one more jacket and I'm done,20,0,0,0,0,2,1,160,big,biggest,Survey,Real_Estate
87,0,Yes I started to send requests to make it but pain came back so I'm back in bed. Double coins at the factory too. I gotta cash in all my nitros.,31,Yes I started to send requests to make it but pain came back so I'm back in bed,18,1,0,1,0,4,0,74,big,biggest,Revenue_Based,Medical
88,0,I'm really not up to it still tonight babe,9,I'm really not up to it still tonight babe,9,1,0,0,0,0,0,52,small,big,Survey,Hospitality
89,0,"Ela kano.,il download, come wen ur free..",7,Ela kano,2,1,0,0,1,1,1,196,small,small,Engagement_Campaign,Industrial
90,0,Yeah do! DonÛ÷t stand to close tho- youÛ÷ll catch something!,10,Yeah do! DonÛ÷t stand to close tho- youÛ÷ll catch something!,10,1,1,0,1,1,0,131,small,big,Revenue_Based,Industrial
91,0,Sorry to be a pain. Is it ok if we meet another night? I spent late afternoon in casualty and that means i haven't done any of y stuff42moro and that includes all my time sheets and that. Sorry. ,39,Sorry to be a pain,5,1,0,0,1,0,2,11,big,med,Promotional,Hospitality
92,0,Smile in Pleasure Smile in Pain Smile when trouble pours like Rain Smile when sum1 Hurts U Smile becoz SOMEONE still Loves to see u Smiling!!,26,Smile in Pleasure Smile in Pain Smile when trouble pours like Rain Smile when sum1 Hurts U Smile becoz SOMEONE still Loves to see u Smiling!!,26,0,1,0,0,3,3,206,big,biggest,No_Opener,Automotive
93,1,Please call our customer service representative on 0800 169 6031 between 10am-9pm as you have WON a guaranteed å£1000 cash or å£5000 prize!,23,Please call our customer service representative on 0800 169 6031 between 10am-9pm as you have WON a guaranteed å£1000 cash or å£5000 prize!,23,0,0,1,1,1,2,77,big,biggest,Promotional,Industrial
94,0,Havent planning to buy later. I check already lido only got 530 show in e afternoon. U finish work already?,20,Havent planning to buy later,5,0,0,1,1,4,0,161,med,med,No_Opener,Real_Estate
95,1,"Your free ringtone is waiting to be collected. Simply text the password \MIX\"" to 85069 to verify. Get Usher and Britney. FML",22,Your free ringtone is waiting to be collected,8,0,1,0,0,4,3,107,big,med,Promotional,Real_Estate
96,0,Watching telugu movie..wat abt u?,5,Watching telugu movie,3,0,1,0,0,0,2,92,small,small,Revenue_Based,Medical
97,0,i see. When we finish we have loads of loans to pay,12,i see,2,1,0,0,1,2,1,36,med,small,Abandoned_Cart,Industrial
98,0,"Hi. Wk been ok - on hols now! Yes on for a bit of a run. Forgot that i have hairdressers appointment at four so need to get home n shower beforehand. Does that cause prob for u?\""ham""",39,Hi,1,1,0,1,1,0,3,238,big,small,Engagement_Campaign,Medical
99,0,Please don't text me anymore. I have nothing else to say.,11,Please don't text me anymore,5,0,0,1,1,4,3,70,med,med,Promotional,Industrial
100,0,Okay name ur price as long as its legal! Wen can I pick them up? Y u ave x ams xx,21,Okay name ur price as long as its legal! Wen can I pick them up? Y u ave x ams xx,21,1,0,0,1,1,0,30,big,biggest,Promotional,Real_Estate
101,0,I'm still looking for a car to buy. And have not gone 4the driving test yet.,16,I'm still looking for a car to buy,8,0,1,1,1,3,2,140,med,med,No_Opener,Automotive
103,0,"wow. You're right! I didn't mean to do that. I guess once i gave up on boston men and changed my search location to nyc, something changed. Cuz on my signin page it still says boston.",36,wow,1,0,0,0,1,0,2,54,big,small,Promotional,Medical
104,0,Umma my life and vava umma love you lot dear,10,Umma my life and vava umma love you lot dear,10,0,0,0,0,0,0,208,small,big,Engagement_Campaign,Industrial
105,0,Thanks a lot for your wishes on my birthday. Thanks you for making my birthday truly memorable.,17,Thanks a lot for your wishes on my birthday,9,0,1,1,0,4,0,152,med,big,Revenue_Based,Industrial
106,0,"Aight, I'll hit you up when I get some cash",10,"Aight, I'll hit you up when I get some cash",10,0,0,0,1,0,0,182,small,big,Survey,Automotive
107,0,How would my ip address test that considering my computer isn't a minecraft server,14,How would my ip address test that considering my computer isn't a minecraft server,14,0,0,0,1,4,1,31,med,bigger,Promotional,Medical
108,0,I know! Grumpy old people. My mom was like you better not be lying. Then again I am always the one to play jokes...,24,I know! Grumpy old people,5,0,0,0,1,3,0,230,big,med,Abandoned_Cart,Real_Estate
109,0,Dont worry. I guess he's busy.,6,Dont worry,2,0,0,0,1,2,2,117,small,small,Engagement_Campaign,Automotive
110,0,What is the plural of the noun research?,8,What is the plural of the noun research?,8,0,1,1,0,3,1,35,small,med,Survey,Industrial
111,0,Going for dinner.msg you after.,5,Going for dinner,3,1,0,0,0,1,1,7,small,small,Promotional,Hospitality
112,0,I'm ok wif it cos i like 2 try new things. But i scared u dun like mah. Cos u said not too loud.,24,I'm ok wif it cos i like 2 try new things,11,1,1,1,1,3,1,40,big,big,No_Opener,Real_Estate
113,1,GENT! We are trying to contact you. Last weekends draw shows that you won a å£1000 prize GUARANTEED. Call 09064012160. Claim Code K52. Valid 12hrs only. 150ppm,27,GENT! We are trying to contact you,7,0,1,1,1,4,3,65,big,med,Abandoned_Cart,Hospitality
114,0,"Wa, ur openin sentence very formal... Anyway, i'm fine too, juz tt i'm eatin too much n puttin on weight...Haha... So anythin special happened?",24,"Wa, ur openin sentence very formal",6,1,0,1,0,4,2,58,big,med,Revenue_Based,Real_Estate
115,0,"As I entered my cabin my PA said, '' Happy B'day Boss !!''. I felt special. She askd me 4 lunch. After lunch she invited me to her apartment. We went there.",32,"As I entered my cabin my PA said, '' Happy B'day Boss !!''",13,0,0,1,0,2,0,13,big,bigger,No_Opener,Hospitality
116,1,You are a winner U have been specially selected 2 receive å£1000 or a 4* holiday (flights inc) speak to a live operator 2 claim 0871277810910p/min (18+) ,27,You are a winner U have been specially selected 2 receive å£1000 or a 4* holiday (flights inc) speak to a live operator 2 claim 0871277810910p/min (18+) ,27,1,0,0,0,1,2,22,big,biggest,Survey,Real_Estate
117,0,Goodo! Yes we must speak friday - egg-potato ratio for tortilla needed! ,12,Goodo! Yes we must speak friday - egg-potato ratio for tortilla needed! ,12,1,1,1,1,1,0,182,med,big,Revenue_Based,Industrial
118,0,Hmm...my uncle just informed me that he's paying the school directly. So pls buy food.,15,Hmm,1,0,0,1,1,4,1,31,med,small,Survey,Industrial
119,1,PRIVATE! Your 2004 Account Statement for 07742676969 shows 786 unredeemed Bonus Points. To claim call 08719180248 Identifier Code: 45239 Expires,20,PRIVATE! Your 2004 Account Statement for 07742676969 shows 786 unredeemed Bonus Points,12,1,1,0,0,2,1,90,med,big,Revenue_Based,Medical
120,1,"URGENT! Your Mobile No. was awarded å£2000 Bonus Caller Prize on 5/9/03 This is our final try to contact U! Call from Landline 09064019788 BOX42WR29C, 150PPM",26,URGENT! Your Mobile No,4,0,1,1,1,0,0,187,big,small,Promotional,Hospitality
121,0,here is my new address -apples&pairs&all that malarky,8,here is my new address -apples&pairs&all that malarky,8,1,0,0,0,0,3,142,small,med,No_Opener,Medical
122,1,Todays Voda numbers ending 7548 are selected to receive a $350 award. If you have a match please call 08712300220 quoting claim code 4041 standard rates app,27,Todays Voda numbers ending 7548 are selected to receive a $350 award,12,0,1,1,0,4,3,182,big,big,Engagement_Campaign,Automotive
123,0,I am going to sao mu today. Will be done only at 12 ,13,I am going to sao mu today,7,0,1,0,0,2,3,76,med,med,Engagement_Campaign,Hospitality
124,0,ÌÏ predict wat time Ì_'ll finish buying?,7,ÌÏ predict wat time Ì_'ll finish buying?,7,1,1,0,0,2,2,128,small,med,Promotional,Real_Estate
125,0,"Good stuff, will do.",4,"Good stuff, will do",4,0,0,0,0,2,2,43,small,small,Survey,Automotive
126,0,"Just so that you know,yetunde hasn't sent money yet. I just sent her a text not to bother sending. So its over, you dont have to involve yourself in anything. I shouldn't have imposed anything on you in the first place so for that, i apologise.",46,"Just so that you know,yetunde hasn't sent money yet",9,1,0,0,1,4,0,87,biggest,big,No_Opener,Real_Estate
127,0,Are you there in room.,5,Are you there in room,5,1,0,1,1,2,3,109,small,med,Engagement_Campaign,Industrial
128,0,HEY GIRL. HOW R U? HOPE U R WELL ME AN DEL R BAK! AGAIN LONG TIME NO C! GIVE ME A CALL SUM TIME FROM LUCYxx,27,HEY GIRL,2,1,1,0,1,0,3,131,big,small,Promotional,Medical
129,0,K..k:)how much does it cost?,5,K,1,0,0,1,1,2,2,70,small,small,Promotional,Automotive
130,0,I'm home.,2,I'm home,2,1,0,0,1,0,2,34,small,small,Revenue_Based,Medical
