,label,text,length,title,title_length,click_through,abandoned_cart,unsubscribed,open_rate,num_pics,num_videos,video_length,length_binned,title_length_binned,campaign_type,industry
1371,0,I though we shd go out n have some fun so bar in town or something ÛÒ sound ok?,19,I though we shd go out n have some fun so bar in town or something ÛÒ sound ok?,19,1,1,1,0,2,1,84,med,biggest,Abandoned_Cart,Real_Estate
1372,0,"1) Go to write msg 2) Put on Dictionary mode 3)Cover the screen with hand, 4)Press  &lt;#&gt; . 5)Gently remove Ur hand.. Its interesting..:)",24,"1) Go to write msg 2) Put on Dictionary mode 3)Cover the screen with hand, 4)Press  &lt;#&gt; ",17,1,1,1,1,1,0,167,big,biggest,Promotional,Hospitality
1373,1,"Bears Pic Nick, and Tom, Pete and ... Dick. In fact, all types try gay chat with photo upload call 08718730666 (10p/min). 2 stop texts call 08712460324",27,"Bears Pic Nick, and Tom, Pete and ",7,1,1,1,1,5,0,210,big,med,Engagement_Campaign,Medical
1374,1,"500 New Mobiles from 2004, MUST GO! Txt: NOKIA to No: 89545 & collect yours today!From ONLY å£1 www.4-tc.biz 2optout 087187262701.50gbp/mtmsg18 TXTAUCTION",22,"500 New Mobiles from 2004, MUST GO! Txt: NOKIA to No: 89545 & collect yours today!From ONLY å£1 www",19,1,1,0,1,2,1,105,big,biggest,Promotional,Industrial
1375,0,We're finally ready fyi,4,We're finally ready fyi,4,0,0,1,0,1,1,52,small,small,Revenue_Based,Medical
1376,0,Auntie huai juan never pick up her phone,8,Auntie huai juan never pick up her phone,8,0,0,0,1,5,2,140,small,med,Survey,Real_Estate
1377,1,Double Mins & Double Txt & 1/2 price Linerental on Latest Orange Bluetooth mobiles. Call MobileUpd8 for the very latest offers. 08000839402 or call2optout/LF56,24,Double Mins & Double Txt & 1/2 price Linerental on Latest Orange Bluetooth mobiles,14,1,1,0,1,3,0,64,big,bigger,No_Opener,Automotive
1378,0,"Ya tel, wats ur problem..",5,"Ya tel, wats ur problem",5,0,0,1,0,5,3,16,small,med,Promotional,Hospitality
1380,0,i dnt wnt to tlk wid u,7,i dnt wnt to tlk wid u,7,1,1,0,1,3,3,32,small,med,Survey,Hospitality
1381,0,"We spend our days waiting for the ideal path to appear in front of us.. But what we forget is.. \paths are made by walking.. not by waiting..\"" Goodnight!""",29,We spend our days waiting for the ideal path to appear in front of us,15,0,1,1,1,1,1,169,big,bigger,Promotional,Medical
1382,0,Its ok my arm is feeling weak cuz i got a shot so we can go another time,18,Its ok my arm is feeling weak cuz i got a shot so we can go another time,18,1,0,1,1,1,3,206,med,biggest,Engagement_Campaign,Real_Estate
1383,0,Please reserve ticket on saturday eve from chennai to thirunelvali and again from tirunelvali to chennai on sunday eve...i already see in net..no ticket available..i want to book ticket through tackle ..,32,Please reserve ticket on saturday eve from chennai to thirunelvali and again from tirunelvali to chennai on sunday eve,19,1,1,1,0,3,0,220,big,biggest,Promotional,Automotive
1384,0,"Storming msg: Wen u lift d phne, u say \HELLO\"" Do u knw wt is d real meaning of HELLO?? . . . It's d name of a girl..! . . . Yes.. And u knw who is dat girl?? \""Margaret Hello\"" She is d girlfrnd f Grahmbell who invnted telphone... . . . . Moral:One can 4get d name of a person",63,"Storming msg: Wen u lift d phne, u say \HELLO\"" Do u knw wt is d real meaning of HELLO?? ",20,0,1,0,0,2,2,150,biggest,biggest,No_Opener,Medical
1385,0,That's ok. I popped in to ask bout something and she said you'd been in. Are you around tonght wen this girl comes?,23,That's ok,2,0,0,1,1,1,0,5,big,small,Engagement_Campaign,Industrial
1386,0,All e best 4 ur exam later.,7,All e best 4 ur exam later,7,0,1,0,1,2,1,217,small,med,No_Opener,Automotive
1387,0,Hope ur head doesn't hurt 2 much ! Am ploughing my way through a pile of ironing ! Staying in with a chinky tonight come round if you like.,29,Hope ur head doesn't hurt 2 much ! Am ploughing my way through a pile of ironing ! Staying in with a chinky tonight come round if you like,29,0,1,0,1,4,0,228,big,biggest,Survey,Medical
1388,0,Oh k.i think most of wi and nz players unsold.,10,Oh k,2,0,1,0,0,3,3,169,small,small,Revenue_Based,Real_Estate
1389,0,"Haha... Where got so fast lose weight, thk muz go 4 a month den got effect... Gee,later we go aust put bk e weight.",24,Haha,1,1,1,0,0,5,2,201,big,small,Promotional,Medical
1390,0,"I wonder how you got online, my love ? Had you gone to the net cafe ? Did you get your phone recharged ? Were you on a friends net ? I think of you, boytoy",36,"I wonder how you got online, my love ? Had you gone to the net cafe ? Did you get your phone recharged ? Were you on a friends net ? I think of you, boytoy",36,1,1,1,0,4,1,184,big,biggest,Abandoned_Cart,Automotive
1391,0,"Haha just kidding, papa needs drugs",6,"Haha just kidding, papa needs drugs",6,0,1,1,0,3,3,103,small,med,No_Opener,Industrial
1392,0,"Thk shld b can... Ya, i wana go 4 lessons... Haha, can go for one whole stretch...",17,Thk shld b can,4,0,0,0,0,4,3,16,med,small,No_Opener,Real_Estate
1393,0,Oh ok..,2,Oh ok,2,1,0,0,1,1,0,61,small,small,Promotional,Automotive
1394,0,R we still meeting 4 dinner tonight?,7,R we still meeting 4 dinner tonight?,7,0,0,1,0,2,3,98,small,med,No_Opener,Real_Estate
1395,0,Thats cool! I am a gentleman and will treat you with dignity and respect.,14,Thats cool! I am a gentleman and will treat you with dignity and respect,14,0,0,0,0,0,3,140,med,bigger,No_Opener,Automotive
1396,0,Shall i start from hear.,5,Shall i start from hear,5,0,1,1,1,1,0,167,small,med,Abandoned_Cart,Real_Estate
1397,0,Then we wait 4 u lor... No need 2 feel bad lar...,12,Then we wait 4 u lor,6,0,0,1,1,0,3,229,med,med,Abandoned_Cart,Industrial
1398,0,No did you check? I got his detailed message now,10,No did you check? I got his detailed message now,10,1,1,1,1,0,1,99,small,big,No_Opener,Hospitality
1399,0,You have registered Sinco as Payee. Log in at icicibank.com and enter URN  &lt;#&gt;  to confirm. Beware of frauds. Do NOT share or disclose URN to anyone.,27,You have registered Sinco as Payee,6,0,1,1,1,4,2,121,big,med,Engagement_Campaign,Real_Estate
1400,0,"No, I decided that only people who care about stuff vote and caring about stuff is for losers",18,"No, I decided that only people who care about stuff vote and caring about stuff is for losers",18,1,1,0,1,5,1,236,med,biggest,No_Opener,Automotive
1401,0,Kaiez... Enjoy ur tuition... Gee... Thk e second option sounds beta... I'll go yan jiu den msg u...,18,Kaiez,1,0,0,1,0,0,2,170,med,small,Survey,Hospitality
1403,0,cool. We will have fun practicing making babies!,8,cool,1,1,1,0,1,3,3,104,small,small,Engagement_Campaign,Industrial
1404,0,Actually getting ready to leave the house.,7,Actually getting ready to leave the house,7,0,1,0,1,1,0,35,small,med,Survey,Real_Estate
1405,0,K..k..any special today?,3,K,1,1,1,0,1,2,2,28,small,small,Revenue_Based,Medical
1406,1,"URGENT, IMPORTANT INFORMATION FOR O2 USER. TODAY IS YOUR LUCKY DAY! 2 FIND OUT WHY LOG ONTO HTTP://WWW.URAWINNER.COM THERE IS A FANTASTIC SURPRISE AWAITING FOR YOU",26,"URGENT, IMPORTANT INFORMATION FOR O2 USER",6,1,0,1,1,0,1,77,big,med,Engagement_Campaign,Automotive
1407,0,Then we gotta do it after that,7,Then we gotta do it after that,7,0,1,1,0,2,0,189,small,med,Survey,Hospitality
1408,0,"I've got ten bucks, jay is being noncomittal",8,"I've got ten bucks, jay is being noncomittal",8,1,0,0,0,3,0,122,small,med,No_Opener,Real_Estate
1409,0,Where at were hungry too,5,Where at were hungry too,5,1,0,0,1,2,3,44,small,med,Revenue_Based,Industrial
1410,0,Pls speak to that customer machan.,6,Pls speak to that customer machan,6,0,1,1,0,2,3,130,small,med,Revenue_Based,Real_Estate
1411,0,somewhere out there beneath the pale moon light someone think in of u some where out there where dreams come true... goodnite &amp; sweet dreams,25,somewhere out there beneath the pale moon light someone think in of u some where out there where dreams come true,21,1,1,0,0,3,2,94,big,biggest,Promotional,Hospitality
1413,1,Dear U've been invited to XCHAT. This is our final attempt to contact u! Txt CHAT to 86688 150p/MsgrcvdHG/Suite342/2Lands/Row/W1J6HL LDN 18 yrs,22,Dear U've been invited to XCHAT,6,1,1,1,1,4,3,7,big,med,Revenue_Based,Automotive
1414,0,So wats ur opinion abt him and how abt is character?,11,So wats ur opinion abt him and how abt is character?,11,1,1,0,0,2,0,153,med,big,Engagement_Campaign,Real_Estate
1415,0,Jay is snickering and tells me that x is totally fucking up the chords as we speak,17,Jay is snickering and tells me that x is totally fucking up the chords as we speak,17,1,0,0,1,4,3,195,med,biggest,Promotional,Automotive
1416,0,No..few hours before.went to hair cut .,7,No,1,1,0,0,1,3,2,69,small,small,Promotional,Automotive
1417,0,No wonder... Cos i dun rem seeing a silver car... But i thk i saw a black one...,18,No wonder,2,1,0,0,1,5,0,167,med,small,Survey,Medical
1418,0,Lmao. Take a pic and send it to me.,9,Lmao,1,1,0,0,1,2,1,39,small,small,Survey,Medical
1419,0,"\Speak only when you feel your words are better than the silence...\"" Gud mrng:-)""",14,\Speak only when you feel your words are better than the silence,12,0,1,0,0,1,2,45,med,big,Abandoned_Cart,Automotive
1420,0,No. She's currently in scotland for that.,7,No,1,1,1,0,0,5,2,165,small,small,Abandoned_Cart,Automotive
1421,0,Do you work all this week ?,7,Do you work all this week ?,7,1,0,1,0,4,1,46,small,med,Engagement_Campaign,Medical
1422,1,Congratulations ur awarded either å£500 of CD gift vouchers & Free entry 2 our å£100 weekly draw txt MUSIC to 87066 TnCs www.Ldew.com 1 win150ppmx3age16,25,Congratulations ur awarded either å£500 of CD gift vouchers & Free entry 2 our å£100 weekly draw txt MUSIC to 87066 TnCs www,23,0,1,1,0,4,1,55,big,biggest,No_Opener,Real_Estate
1423,0,Lol great now im getting hungry.,6,Lol great now im getting hungry,6,0,1,1,0,4,2,120,small,med,Abandoned_Cart,Medical
1424,0,Yes.. now only saw your message..,6,Yes,1,0,1,0,0,1,1,28,small,small,Revenue_Based,Automotive
1425,0,I'll be at mu in like  &lt;#&gt;  seconds,8,I'll be at mu in like  &lt;#&gt;  seconds,8,0,1,0,1,0,1,87,small,med,Engagement_Campaign,Industrial
1427,0,THING R GOOD THANX GOT EXAMS IN MARCH IVE DONE NO REVISION? IS FRAN STILL WITH BOYF? IVE GOTTA INTERVIW 4 EXETER BIT WORRIED!x,24,THING R GOOD THANX GOT EXAMS IN MARCH IVE DONE NO REVISION? IS FRAN STILL WITH BOYF? IVE GOTTA INTERVIW 4 EXETER BIT WORRIED!x,24,1,0,0,1,1,2,80,big,biggest,Survey,Hospitality
1428,0,"Tell you what, if you make a little spreadsheet and track whose idea it was to smoke to determine who \smokes too much\"" for the entire month of february",29,"Tell you what, if you make a little spreadsheet and track whose idea it was to smoke to determine who \smokes too much\"" for the entire month of february",29,0,1,1,0,2,1,132,big,biggest,Revenue_Based,Hospitality
1429,1,For sale - arsenal dartboard. Good condition but no doubles or trebles!,12,For sale - arsenal dartboard,5,0,1,1,0,4,0,19,med,med,No_Opener,Medical
1430,0,Don't look back at the building because you have no coat and i don't want you to get more sick. Just hurry home and wear a coat to the gym!!!,30,Don't look back at the building because you have no coat and i don't want you to get more sick,20,1,0,1,0,4,3,218,big,biggest,No_Opener,Industrial
1431,0,"My painful personal thought- \I always try to keep everybody happy all the time. But nobody recognises me when i am alone\""""",22,My painful personal thought- \I always try to keep everybody happy all the time,14,1,0,1,1,3,2,231,big,bigger,Revenue_Based,Hospitality
1432,0,Thanks for ve lovely wisheds. You rock,7,Thanks for ve lovely wisheds,5,0,1,0,1,2,3,55,small,med,Promotional,Medical
1433,0,You intrepid duo you! Have a great time and see you both soon. ,13,You intrepid duo you! Have a great time and see you both soon,13,0,0,0,0,0,3,92,med,bigger,Promotional,Medical
1434,0,I asked sen to come chennai and search for job.,10,I asked sen to come chennai and search for job,10,0,0,1,1,4,3,76,small,big,Abandoned_Cart,Industrial
1435,0,Dad went out oredi... ,4,Dad went out oredi,4,1,1,1,1,5,3,185,small,small,Engagement_Campaign,Hospitality
1436,0,"I jus hope its true that  missin me cos i'm really missin him! You haven't done anything to feel guilty about, yet.",22,"I jus hope its true that  missin me cos i'm really missin him! You haven't done anything to feel guilty about, yet",22,1,0,1,0,5,0,90,big,biggest,Engagement_Campaign,Hospitality
1437,0,Wat so late still early mah. Or we juz go 4 dinner lor. Aiya i dunno...,16,Wat so late still early mah,6,0,1,1,1,3,0,233,med,med,Revenue_Based,Real_Estate
1438,0,"Arms fine, how's Cardiff and uni? ",6,"Arms fine, how's Cardiff and uni? ",6,0,1,1,1,4,1,15,small,med,Promotional,Medical
1439,0,In fact when do you leave? I think addie goes back to school tues or wed,16,In fact when do you leave? I think addie goes back to school tues or wed,16,1,1,0,0,5,3,100,med,bigger,No_Opener,Medical
1440,0,"Cool breeze... Bright sun... Fresh flower... Twittering birds... All these waiting to wish u: \GOODMORNING &amp; HAVE A NICE DAY\"" :)""",21,Cool breeze,2,0,0,0,0,5,0,172,big,small,Revenue_Based,Hospitality
1441,0,Ya:)going for restaurant..,3,Ya:)going for restaurant,3,0,0,1,1,4,3,40,small,small,Engagement_Campaign,Medical
1442,0,"Its ok., i just askd did u knw tht no?",10,Its ok,2,1,0,1,1,5,2,116,small,small,Promotional,Automotive
1443,1,Free 1st week entry 2 TEXTPOD 4 a chance 2 win 40GB iPod or å£250 cash every wk. Txt POD to 84128 Ts&Cs www.textpod.net custcare 08712405020.,26,Free 1st week entry 2 TEXTPOD 4 a chance 2 win 40GB iPod or å£250 cash every wk,18,1,0,1,0,1,1,235,big,biggest,No_Opener,Industrial
1444,0,Those ducking chinchillas,3,Those ducking chinchillas,3,0,0,0,1,1,3,166,small,small,No_Opener,Real_Estate
1445,0,I am in a marriage function,6,I am in a marriage function,6,1,0,1,1,4,0,95,small,med,Promotional,Medical
1446,0,Looks like u wil b getting a headstart im leaving here bout 2.30ish but if u r desperate for my company I could head in earlier-we were goin to meet in rummer.,32,Looks like u wil b getting a headstart im leaving here bout 2,13,1,1,0,0,0,3,50,big,bigger,No_Opener,Automotive
1447,0,DonÛ÷t give a flying monkeys wot they think and I certainly donÛ÷t mind. Any friend of mine and all that!,20,DonÛ÷t give a flying monkeys wot they think and I certainly donÛ÷t mind,13,0,1,1,0,0,3,155,med,bigger,Revenue_Based,Medical
1448,1,As a registered optin subscriber ur draw 4 å£100 gift voucher will be entered on receipt of a correct ans to 80062 Whats No1 in the BBC charts,28,As a registered optin subscriber ur draw 4 å£100 gift voucher will be entered on receipt of a correct ans to 80062 Whats No1 in the BBC charts,28,1,1,1,0,1,3,22,big,biggest,No_Opener,Automotive
1449,0,say thanks2. ,2,say thanks2,2,0,1,0,1,4,0,119,small,small,Survey,Automotive
1450,0,Msg me when rajini comes.,5,Msg me when rajini comes,5,0,0,1,1,4,2,81,small,med,Engagement_Campaign,Medical
1451,0,Ya! when are Ì_ taking ure practical lessons? I start in june..  ,12,Ya! when are Ì_ taking ure practical lessons? I start in june,12,0,0,0,1,5,3,14,med,big,Engagement_Campaign,Hospitality
1452,0,"That's good, because I need drugs",6,"That's good, because I need drugs",6,0,0,0,1,3,2,41,small,med,Promotional,Hospitality
1453,0,Stupid.its not possible,3,Stupid,1,1,0,0,0,2,2,70,small,small,Promotional,Real_Estate
1454,0,Can Ì_ all decide faster cos my sis going home liao..,11,Can Ì_ all decide faster cos my sis going home liao,11,1,0,1,0,3,0,85,med,big,Survey,Real_Estate
1455,1,Summers finally here! Fancy a chat or flirt with sexy singles in yr area? To get MATCHED up just reply SUMMER now. Free 2 Join. OptOut txt STOP Help08714742804,29,Summers finally here! Fancy a chat or flirt with sexy singles in yr area? To get MATCHED up just reply SUMMER now,22,1,0,1,1,5,2,186,big,biggest,Promotional,Hospitality
1456,0,U sleeping now.. Or you going to take? Haha.. I got spys wat.. Me online checking n replying mails lor..,20,U sleeping now,3,1,1,0,1,3,0,84,med,small,Survey,Automotive
1457,1,CLAIRE here am havin borin time & am now alone U wanna cum over 2nite? Chat now 09099725823 hope 2 C U Luv CLAIRE xx Callså£1/minmoremobsEMSPOBox45PO139WA,26,CLAIRE here am havin borin time & am now alone U wanna cum over 2nite? Chat now 09099725823 hope 2 C U Luv CLAIRE xx Callså£1/minmoremobsEMSPOBox45PO139WA,26,1,1,0,0,3,3,235,big,biggest,No_Opener,Automotive
1459,1,Bought one ringtone and now getting texts costing 3 pound offering more tones etc,14,Bought one ringtone and now getting texts costing 3 pound offering more tones etc,14,1,0,0,0,2,2,187,med,bigger,Promotional,Automotive
1460,0,"Yalru lyfu astne chikku.. Bt innu mundhe lyf ali halla ke bilo (marriage)program edhae, so lyf is nt yet ovr chikku..ali vargu lyfu meow meow:-D",25,Yalru lyfu astne chikku,4,0,1,1,0,3,1,46,big,small,Promotional,Real_Estate
1461,0,Kinda. First one gets in at twelve! Aah. Speak tomo,10,Kinda,1,1,0,0,0,1,0,24,small,small,Promotional,Real_Estate
1462,1,"09066362231 URGENT! Your mobile No 07xxxxxxxxx won a å£2,000 bonus caller prize on 02/06/03! this is the 2nd attempt to reach YOU! call 09066362231 ASAP!",25,"09066362231 URGENT! Your mobile No 07xxxxxxxxx won a å£2,000 bonus caller prize on 02/06/03! this is the 2nd attempt to reach YOU! call 09066362231 ASAP!",25,1,1,1,1,5,0,86,big,biggest,Engagement_Campaign,Medical
1463,0,Ok good then i later come find Ì_... C lucky i told Ì_ to go earlier... Later pple take finish Ì_ no more again...,24,Ok good then i later come find Ì_,8,0,1,0,0,4,1,215,big,med,Survey,Medical
1464,0,Wat makes u thk i'll fall down. But actually i thk i'm quite prone 2 falls. Lucky my dad at home i ask him come n fetch me already.,29,Wat makes u thk i'll fall down,7,1,0,1,1,3,3,156,big,med,Abandoned_Cart,Medical
1465,1,"YOU 07801543489 are guaranteed the latests Nokia Phone, a 40GB iPod MP3 player or a å£500 prize! Txt word:COLLECT to No:83355! TC-LLC NY-USA 150p/Mt msgrcvd18+",25,"YOU 07801543489 are guaranteed the latests Nokia Phone, a 40GB iPod MP3 player or a å£500 prize! Txt word:COLLECT to No:83355! TC-LLC NY-USA 150p/Mt msgrcvd18+",25,1,1,1,1,1,2,143,big,biggest,Survey,Industrial
1467,0,I wont touch you with out your permission.,8,I wont touch you with out your permission,8,1,0,1,0,2,3,88,small,med,Abandoned_Cart,Real_Estate
1468,1,Hi its LUCY Hubby at meetins all day Fri & I will B alone at hotel U fancy cumin over? Pls leave msg 2day 09099726395 Lucy x Callså£1/minMobsmoreLKPOBOX177HP51FL,28,Hi its LUCY Hubby at meetins all day Fri & I will B alone at hotel U fancy cumin over? Pls leave msg 2day 09099726395 Lucy x Callså£1/minMobsmoreLKPOBOX177HP51FL,28,0,0,0,0,5,3,63,big,biggest,Survey,Industrial
1469,0,"7 wonders in My WORLD 7th You 6th Ur style 5th Ur smile 4th Ur Personality 3rd Ur Nature 2nd Ur SMS and 1st \Ur Lovely Friendship\""... good morning dear""",30,"7 wonders in My WORLD 7th You 6th Ur style 5th Ur smile 4th Ur Personality 3rd Ur Nature 2nd Ur SMS and 1st \Ur Lovely Friendship\""",27,0,1,1,1,5,1,136,big,biggest,Revenue_Based,Automotive
1470,0,Take some small dose tablet for fever,7,Take some small dose tablet for fever,7,1,0,1,1,3,1,62,small,med,No_Opener,Real_Estate
1471,0,Oh. U must have taken your REAL Valentine out shopping first.,11,Oh,1,0,1,0,0,3,3,73,med,small,Survey,Hospitality
1472,0,"Just sent you an email ÛÒ to an address with incomm in it, is that right?",16,"Just sent you an email ÛÒ to an address with incomm in it, is that right?",16,0,1,0,0,4,1,98,med,bigger,Revenue_Based,Hospitality
1473,0,"Will do, you gonna be at blake's all night? I might be able to get out of here a little early",21,"Will do, you gonna be at blake's all night? I might be able to get out of here a little early",21,0,1,0,1,5,3,82,big,biggest,Engagement_Campaign,Automotive
1474,0,"Friendship is not a game to play, It is not a word to say, It doesn\'t start on March and ends on May, It is tomorrow, yesterday, today and e",30,"Friendship is not a game to play, It is not a word to say, It doesn\'t start on March and ends on May, It is tomorrow, yesterday, today and e",30,0,0,1,0,0,1,0,big,biggest,Engagement_Campaign,Industrial
1475,0,"Nice. Wait...should you be texting right now? I'm not gonna pay your ticket, ya know!",15,Nice,1,0,0,1,1,0,1,13,med,small,Engagement_Campaign,Hospitality
1476,0,I'm watching lotr w my sis dis aft. So u wan 2 meet me 4 dinner at nite a not?,20,I'm watching lotr w my sis dis aft,8,0,0,0,0,2,1,211,med,med,Survey,Real_Estate
1477,0,Why you keeping me away like this,7,Why you keeping me away like this,7,1,0,0,0,5,0,152,small,med,Engagement_Campaign,Automotive
1478,0,I think its far more than that but find out. Check google maps for a place from your dorm.,19,I think its far more than that but find out,10,1,1,0,1,2,0,154,med,big,Revenue_Based,Hospitality
1479,0,My trip was ok but quite tiring lor. Uni starts today but it's ok 4 me cos i'm not taking any modules but jus concentrating on my final yr project.,30,My trip was ok but quite tiring lor,8,0,0,0,0,1,3,1,big,med,Engagement_Campaign,Medical
1480,0,Have you always been saying welp?,6,Have you always been saying welp?,6,0,1,1,1,3,0,236,small,med,No_Opener,Hospitality
1481,0,"I'm a guy, browsin is compulsory",6,"I'm a guy, browsin is compulsory",6,1,1,0,1,0,3,52,small,med,Abandoned_Cart,Hospitality
1483,0,Purity of friendship between two is not about smiling after reading the forwarded message..Its about smiling just by seeing the name. Gud evng musthu,24,Purity of friendship between two is not about smiling after reading the forwarded message,14,0,0,1,1,0,3,86,big,bigger,Engagement_Campaign,Real_Estate
1485,0,"(I should add that I don't really care and if you can't I can at least get this dude to fuck off but hey, your money if you want it)",30,"(I should add that I don't really care and if you can't I can at least get this dude to fuck off but hey, your money if you want it)",30,1,0,1,0,3,0,153,big,biggest,Revenue_Based,Automotive
1486,0,"Hello lover! How goes that new job? Are you there now? Are you happy? Do you think of me? I wake, my slave and send you a teasing kiss from across the sea",33,"Hello lover! How goes that new job? Are you there now? Are you happy? Do you think of me? I wake, my slave and send you a teasing kiss from across the sea",33,1,0,0,0,2,2,10,big,biggest,Engagement_Campaign,Automotive
1487,0,I told your number to gautham..,6,I told your number to gautham,6,1,1,0,1,2,1,43,small,med,Engagement_Campaign,Real_Estate
1488,0,Tell them no need to investigate about me anywhere.,9,Tell them no need to investigate about me anywhere,9,1,1,1,0,2,3,212,small,big,Promotional,Hospitality
1489,0,Ok i juz receive..,4,Ok i juz receive,4,1,1,0,1,3,1,162,small,small,Survey,Industrial
1490,0,"Cant believe i said so many things to you this morning when all i really wanted to say was good morning, i love you! Have a beautiful morning. See you in the library later.",34,"Cant believe i said so many things to you this morning when all i really wanted to say was good morning, i love you! Have a beautiful morning",28,0,1,1,0,5,3,2,big,biggest,Revenue_Based,Automotive
1491,1,"Your account has been credited with 500 FREE Text Messages. To activate, just txt the word: CREDIT to No: 80488 T&Cs www.80488.biz",22,Your account has been credited with 500 FREE Text Messages,10,0,1,1,1,4,3,191,big,big,Engagement_Campaign,Automotive
1492,0,In the end she might still vomit but its okay. Not everything will come out.,15,In the end she might still vomit but its okay,10,0,1,0,0,4,2,160,med,big,Revenue_Based,Real_Estate
1493,0,How are you with moneY...as in to you...money aint a thing....how are you sha!,14,How are you with moneY,5,1,0,0,0,5,2,168,med,med,Promotional,Hospitality
1494,0,It has everything to do with the weather. Keep extra warm. Its a cold but nothing serious. Pls lots of vitamin c,22,It has everything to do with the weather,8,0,0,1,0,1,2,44,big,med,Survey,Industrial
1495,0,Hey gals.. Anyone of u going down to e driving centre tmr?,12,Hey gals,2,0,1,0,1,4,3,31,med,small,Survey,Automotive
1496,0,I'm always on yahoo messenger now. Just send the message to me and i.ll get it you may have to send it in the mobile mode sha but i.ll get it. And will reply.,34,I'm always on yahoo messenger now,6,1,0,1,0,4,0,19,big,med,Survey,Real_Estate
1497,0,I'm putting it on now. It should be ready for  &lt;TIME&gt; ,11,I'm putting it on now,5,1,1,1,0,5,2,143,med,med,Promotional,Medical
1498,0,"Time n Smile r the two crucial things in our life. Sometimes time makes us to forget smile, and sometimes someone's smile makes us to forget time gud noon",29,Time n Smile r the two crucial things in our life,11,0,0,1,1,3,2,159,big,big,No_Opener,Hospitality
1499,1,"SMS. ac JSco: Energy is high, but u may not know where 2channel it. 2day ur leadership skills r strong. Psychic? Reply ANS w/question. End? Reply END JSCO",28,SMS,1,0,0,0,0,2,3,88,big,small,Revenue_Based,Hospitality
1500,0,Host-based IDPS for linux systems.,5,Host-based IDPS for linux systems,5,0,0,0,1,1,0,187,small,med,Promotional,Hospitality
1501,1,"HOT LIVE FANTASIES call now 08707509020 Just 20p per min NTT Ltd, PO Box 1327 Croydon CR9 5WB 0870 is a national rate call",24,"HOT LIVE FANTASIES call now 08707509020 Just 20p per min NTT Ltd, PO Box 1327 Croydon CR9 5WB 0870 is a national rate call",24,0,1,0,1,3,1,65,big,biggest,Abandoned_Cart,Hospitality
1502,0,Don no da:)whats you plan?,5,Don no da:)whats you plan?,5,0,1,0,0,1,1,112,small,med,No_Opener,Real_Estate
1503,0,Ill be there on  &lt;#&gt;  ok.,6,Ill be there on  &lt;#&gt;  ok,6,0,1,1,1,5,3,49,small,med,Revenue_Based,Hospitality
1504,0,Oh my God. I'm almost home,6,Oh my God,3,1,0,1,0,0,1,121,small,small,Survey,Real_Estate
1505,0,Total video converter free download type this in google search:),10,Total video converter free download type this in google search:),10,0,1,1,0,5,3,94,small,big,Revenue_Based,Industrial
